{
  "id": "relic_frost_shard",
  "name": "Relic Frost Shard",
  "description": "Three armour left brittle with the cold. Cold enough to slow a wound — backstabs leave frost in the bone.",
  "maxStacks": 1,
  "stats": {
    "armor": -3,
    "physicalDamage": 4
  },
  "tags": [
    "frost"
  ],
  "weight": 1,
  "rules": [
    {
      "event": "onBackstab",
      "effect": "apply_status",
      "statusId": "freeze",
      "stacks": 1
    }
  ],
  "offerable": true
}
