{
  "id": "mourners_interest",
  "name": "Mourner’s Interest",
  "description": "Eight health mourned in advance. Three percent more damage, and kills against the frozen return health.",
  "maxStacks": 2,
  "stats": {
    "damagePercent": 3,
    "maxHealth": -8
  },
  "tags": [
    "frost",
    "blood"
  ],
  "weight": 0.8,
  "rules": [
    {
      "event": "onKill",
      "effect": "restore_health",
      "amount": 10,
      "ifTargetHasStatus": "freeze"
    }
  ],
  "offerable": true
}
