{
  "id": "the_quiet_start",
  "name": "The Quiet Start",
  "description": "Three percent strength spent before the first step. The run begins with coin someone else no longer needs.",
  "maxStacks": 1,
  "tags": [
    "greed"
  ],
  "weight": 0.6,
  "rules": [
    {
      "event": "onAcquired",
      "effect": "bonus_gold",
      "amount": 120,
      "ifAcquiredRelic": "the_quiet_start"
    }
  ],
  "offerable": true,
  "stats": {
    "damagePercent": -3
  }
}
