{
  "id": "quiet_hands",
  "name": "Quiet Hands",
  "description": "Five armour traded for silence. A backstab that lands returns half its damage as health.",
  "maxStacks": 1,
  "tags": [
    "blood",
    "swift"
  ],
  "weight": 0.9,
  "rules": [
    {
      "event": "onBackstab",
      "effect": "lifesteal",
      "pct": 0.5
    }
  ],
  "offerable": true,
  "stats": {
    "armor": -5
  }
}
