{
  "id": "the_narrow_path",
  "name": "The Narrow Path",
  "description": "Eight health risked to move like this. Perfect dodges sharpen you until something lands.",
  "maxStacks": 1,
  "stats": {
    "moveSpeedPercent": 4,
    "maxHealth": -8
  },
  "tags": [
    "swift",
    "ruin"
  ],
  "weight": 0.8,
  "rules": [
    {
      "event": "onPerfectDodge",
      "effect": "add_stack",
      "stackId": "narrow",
      "maxStacks": 6,
      "stat": "damagePercent",
      "perStack": 3,
      "resetOn": [
        "onHitTaken"
      ]
    }
  ],
  "offerable": true
}
